User Input,Chatbot Response,Timestamp
hii,"Gardening tips include choosing the right plants for your climate, watering properly, and using organic fertilizers.",2025-03-13 16:28:18
hello,Hey,2025-03-13 16:28:32
tell me a tip,"I may not have personal preferences, but I can help you find movies based on your taste!",2025-03-13 16:28:49
give me a movie,"I may not have personal preferences, but I can help you find movies based on your taste!",2025-03-13 16:29:05
what about you,I am a chatbot,2025-03-13 16:29:41
what can you do,I can answer questions and provide assistance,2025-03-13 16:29:48
can you help me,I'm here to help. What's the problem?,2025-03-13 16:30:10
whats your age,"Reading books can broaden your knowledge, enhance creativity, and provide a great way to relax.",2025-03-13 16:30:19
